{"contractVersion":"nest.worker.v1","taskRef":"task:retrieval-sufficient","worldRef":"world:alpha","taskKind":"RETRIEVAL","attempt":1,"generation":4,"deadlineAt":"2026-09-22T10:00:00Z","budget":{"modelCalls":1,"toolCalls":4,"inputTokens":4000,"outputTokens":1500,"totalClockMs":60000},"allowedCapabilities":["READ_MEMORY","READ_RELATIONS","RESOLVE_CANDIDATES"],"sessionRef":"session:alpha","targetTurnRef":"turn:sufficient","inputVersion":"input-v2","sourceExclusion":[{"sourceRef":"source:fixture-1","sourceVersion":"source-v1","startCursor":"cursor-a","endCursor":"cursor-b"}],"deliveredRevisionRefs":["revision:old"],"contextMaterials":[{"materialRef":"material:turn-context","kind":"CURRENT_USER_TURN","text":"Synthetic turn: which fixture decision applies?"},{"materialRef":"material:nearby","kind":"NEARBY_MESSAGE","text":"Synthetic nearby message."}],"outputContractVersion":"nest.worker.v1"}
