{"contractVersion":"nest.worker.v1","taskRef":"task:retrieval-no-query","worldRef":"world:alpha","taskKind":"RETRIEVAL","attempt":1,"generation":0,"deadlineAt":"2026-09-22T10:00:00Z","budget":{"modelCalls":0,"toolCalls":2,"inputTokens":2000,"outputTokens":1000,"totalClockMs":30000},"allowedCapabilities":["READ_MEMORY","RESOLVE_CANDIDATES"],"sessionRef":"session:alpha","targetTurnRef":"turn:no-query","inputVersion":"input-v1","sourceExclusion":[],"deliveredRevisionRefs":[],"contextMaterials":[{"materialRef":"material:current-no-query","kind":"CURRENT_USER_TURN","text":"Synthetic turn: hello."}],"outputContractVersion":"nest.worker.v1"}
