{"contractVersion":"nest.worker.v1","taskRef":"task:index-revise","worldRef":"world:alpha","taskKind":"INDEX_PROJECTION","attempt":1,"generation":8,"deadlineAt":"2026-09-23T10:00:00Z","budget":{"modelCalls":0,"toolCalls":1,"inputTokens":0,"outputTokens":0,"totalClockMs":30000},"allowedCapabilities":["PROJECT_INDEX"],"eventRef":"event:20202020-2020-4020-8020-202020202020","projectionGeneration":42,"materialDigest":"sha256:da0d8e617206d1e8d10d2414f1d283fea111ce433bd6221a9c125b662be5866a","embeddingManifest":{"modelRef":"embedding:fixture-model","dimensions":384,"version":"fixture-v1"},"schemaManifest":{"schemaRef":"index-schema:fixture-v1","version":"fixture-v1"},"projectionMaterial":{"eventKind":"MEMORY_REVISED","recordRef":"record:11111111-1111-4111-8111-111111111111","revisionRef":"revision:bbbbbbbb-bbbb-4bbb-8bbb-bbbbbbbbbbbb","revisionNo":2,"type":"EVENT","content":"Synthetic revised event.","subject":"fixture-subject","scope":"fixture-scope","perspective":"fixture-perspective","conditions":null,"timeContext":"fixture-time","uncertainty":null,"supportingRevisionRefs":["revision:aaaaaaaa-aaaa-4aaa-8aaa-aaaaaaaaaaaa"],"counterRevisionRefs":[],"successorRefs":[],"predecessor":{"recordRef":"record:11111111-1111-4111-8111-111111111111","revisionRef":"revision:aaaaaaaa-aaaa-4aaa-8aaa-aaaaaaaaaaaa"},"relatedRevisionMaterials":[{"recordRef":"record:11111111-1111-4111-8111-111111111111","revisionRef":"revision:aaaaaaaa-aaaa-4aaa-8aaa-aaaaaaaaaaaa","type":"EVENT","content":"Synthetic committed event.","subject":"fixture-subject","scope":"fixture-scope","perspective":"fixture-perspective","conditions":null,"timeContext":"fixture-time","uncertainty":null,"supportingRevisionRefs":[],"counterRevisionRefs":[]}]},"outputContractVersion":"nest.worker.v1"}
