{"contractVersion":"nest.worker.v1","taskRef":"task:index-create","worldRef":"world:alpha","taskKind":"INDEX_PROJECTION","attempt":1,"generation":7,"deadlineAt":"2026-09-23T10:00:00Z","budget":{"modelCalls":0,"toolCalls":1,"inputTokens":0,"outputTokens":0,"totalClockMs":30000},"allowedCapabilities":["PROJECT_INDEX"],"eventRef":"event:10101010-1010-4010-8010-101010101010","projectionGeneration":42,"materialDigest":"sha256:d1bdd23f8d443df981cb9f1dbea688a47e995fbf98d25bbd2ec5ac9ec6b537b5","embeddingManifest":{"modelRef":"embedding:fixture-model","dimensions":384,"version":"fixture-v1"},"schemaManifest":{"schemaRef":"index-schema:fixture-v1","version":"fixture-v1"},"projectionMaterial":{"eventKind":"MEMORY_CREATED","recordRef":"record:11111111-1111-4111-8111-111111111111","revisionRef":"revision:aaaaaaaa-aaaa-4aaa-8aaa-aaaaaaaaaaaa","revisionNo":1,"type":"EVENT","content":"Synthetic committed event.","subject":"fixture-subject","scope":"fixture-scope","perspective":"fixture-perspective","conditions":null,"timeContext":"fixture-time","uncertainty":null,"supportingRevisionRefs":[],"counterRevisionRefs":[],"successorRefs":[]},"outputContractVersion":"nest.worker.v1"}
