{"contractVersion":"nest.worker.v1","taskRef":"task:index-supersede","worldRef":"world:alpha","taskKind":"INDEX_PROJECTION","attempt":1,"generation":9,"deadlineAt":"2026-09-23T10:00:00Z","budget":{"modelCalls":0,"toolCalls":1,"inputTokens":0,"outputTokens":0,"totalClockMs":30000},"allowedCapabilities":["PROJECT_INDEX"],"eventRef":"event:30303030-3030-4030-8030-303030303030","projectionGeneration":42,"materialDigest":"sha256:ec9b549cbfdb248f52f59196998591c9a84510149aba0244a7f513f14481ef5f","embeddingManifest":{"modelRef":"embedding:fixture-model","dimensions":384,"version":"fixture-v1"},"schemaManifest":{"schemaRef":"index-schema:fixture-v1","version":"fixture-v1"},"projectionMaterial":{"eventKind":"MEMORY_SUPERSEDED","recordRef":"record:22222222-2222-4222-8222-222222222222","revisionRef":"revision:cccccccc-cccc-4ccc-8ccc-cccccccccccc","revisionNo":1,"type":"UNDERSTANDING","content":"Synthetic successor interpretation.","subject":"fixture-subject","scope":"fixture-scope","perspective":"fixture-perspective","conditions":null,"timeContext":"fixture-time","uncertainty":null,"supportingRevisionRefs":["revision:bbbbbbbb-bbbb-4bbb-8bbb-bbbbbbbbbbbb"],"counterRevisionRefs":[],"successorRefs":[],"predecessor":{"recordRef":"record:11111111-1111-4111-8111-111111111111","revisionRef":"revision:bbbbbbbb-bbbb-4bbb-8bbb-bbbbbbbbbbbb"}},"outputContractVersion":"nest.worker.v1"}
