{"contractVersion":"nest.worker.v1","taskRef":"task:formation-create","worldRef":"world:alpha","taskKind":"FORMATION","attempt":1,"generation":2,"deadlineAt":"2026-09-22T10:00:00Z","budget":{"modelCalls":1,"toolCalls":3,"inputTokens":3000,"outputTokens":1000,"totalClockMs":60000},"allowedCapabilities":["READ_SOURCE","SUBMIT_WRITE_SET"],"sourceWorkRef":"source-work:fixture-1","outputContractVersion":"nest.worker.v1"}
